{
  "protocol": "arcont-bridge",
  "version": 1,
  "request_id": "bootstrap-new-game-001",
  "operation": "project.bootstrap",
  "arguments": {
    "template": "godot-3d-minimal",
    "intent": {
      "protocol": "arcont-project-intent",
      "version": 1,
      "project_id": "new_game",
      "title": "New Game",
      "genre": "third-person action",
      "targets": ["Windows", "Android"],
      "visual_style": "dark industrial",
      "priorities": ["movement", "combat", "performance"],
      "performance": {"target_fps": 60, "resolution": "1280x720"},
      "asset_policy": {
        "user_assets": true,
        "public_assets": false,
        "commercial_use_required": true,
        "allow_network_discovery": false
      }
    }
  }
}
